{"actor_assignment_sha256":"40af8032c580b7faef6019b5025d9c94f7e3ba63b970fbc4e93df3a5fdd17e2d","artifact_type":"phase3_work_item_receipt","command":["readiness","--identity","P3-R06-7fbd226-20260810-I01-W07","--output","artifacts/phase-3/P3-R06-7fbd226-20260810-I01/readiness","--prep-root","artifacts/phase-3-prep/P3-PREP-7fbd226-20260810-r03","--release-root","artifacts/phase-3/P3-R06-7fbd226-20260810-I01","--actor-assignments","artifacts/phase-3/P3-R06-7fbd226-20260810-I01/control/actor-assignments-formal.json","--emit-work-item-receipt","--upstream-receipt","artifacts/phase-3-prep/P3-PREP-7fbd226-20260810-r03/work-items/W06/receipt.json","--upstream-actor-assignments","artifacts/phase-3-prep/P3-PREP-7fbd226-20260810-r03/control/actor-assignments-preparation.json","--work-item-receipt","artifacts/phase-3/P3-R06-7fbd226-20260810-I01/work-items/W07/receipt.json"],"ended_at_utc":"2026-08-10T01:52:03.754120Z","identity":"P3-R06-7fbd226-20260810-I01-W07","inputs":[{"path":"artifacts/phase-3/P3-R06-7fbd226-20260810-I01/control/actor-assignments-formal.json","sha256":"40af8032c580b7faef6019b5025d9c94f7e3ba63b970fbc4e93df3a5fdd17e2d"},{"path":"artifacts/phase-3-prep/P3-PREP-7fbd226-20260810-r03/control/actor-assignments-preparation.json","sha256":"5cc39617cbaae7979d9e616129eaa0be382be73c7ce26e73eb0b140a0344daa2"},{"path":"artifacts/phase-3-prep/P3-PREP-7fbd226-20260810-r03/work-items/W06/receipt.json","sha256":"fe8fae9e013c6edeea41f841d0557808d965cdd9acedc4a04c44c217c267112e"}],"outputs":[{"path":"artifacts/phase-3/P3-R06-7fbd226-20260810-I01/control/approved-workload.json","sha256":"a55dba3a2c165f9bbce40b3f3d181115ef74c3bf513f8f757c51e18e25184b86"},{"path":"artifacts/phase-3/P3-R06-7fbd226-20260810-I01/control/artifact-whitelist.json","sha256":"df974f280e77fe87219960d5a7bdd20e04b7091db5bfc471b8642d52d0cdd34d"},{"path":"artifacts/phase-3/P3-R06-7fbd226-20260810-I01/control/formal-authorization.json","sha256":"008e7b03059543d48f96b4895012f3a9f034735e5b0fd15b021c95d49d77162c"},{"path":"artifacts/phase-3/P3-R06-7fbd226-20260810-I01/control/formal-run-registry.json","sha256":"c78efb5e303518bd00231e2afc29558c4aedb1023632386c5f2f696e021d9def"},{"path":"artifacts/phase-3/P3-R06-7fbd226-20260810-I01/control/implementation-inventory.json","sha256":"65338a82ddb3ae7ef7f24cec319d195d51a1be4cf20a4b4077f1a8d5003eddad"},{"path":"artifacts/phase-3/P3-R06-7fbd226-20260810-I01/readiness/evidence-return-canary.bin","sha256":"3a1fef1ddbdf4ae68c7cd764d23d0bed2be83217a7e40a20ba3f44c8ed38f6cd"},{"path":"artifacts/phase-3/P3-R06-7fbd226-20260810-I01/readiness/readiness.json","sha256":"e8cf29ac02d60da4bbbbfca01efdda16962331a34e62ab04023f7dc2ec971e73"}],"owner_id":"P3-ROOT-EXECUTOR-20260810-R00","owner_role":"release_controller","owner_session_id":"019fe8fd-036d-7252-ac76-85f627272117","owner_task_id":"phase3-formal-replay-20260810-r00","process_exit_code":0,"schema_version":"3.0.0","started_at_utc":"2026-08-10T01:39:39.994527Z","status":"PASS","terminal":"READY","work_item":"W07"}
