{"actor_assignment_sha256":"a944b72283b5bd834c4d4e47ab7e68d1cb314714fc478e42d3383fbba0975dfb","artifact_type":"phase3_work_item_receipt","command":["replay","--identity","P3-R01-4653223-20260809-I01-W10","--output","artifacts/phase-3/P3-R01-4653223-20260809-I01/replay","--release-root","artifacts/phase-3/P3-R01-4653223-20260809-I01","--actor-assignments","artifacts/phase-3/P3-R01-4653223-20260809-I01/control/actor-assignments-formal.json","--emit-work-item-receipt","--upstream-receipt","artifacts/phase-3/P3-R01-4653223-20260809-I01/work-items/W09/receipt.json","--work-item-receipt","artifacts/phase-3/P3-R01-4653223-20260809-I01/work-items/W10/receipt.json"],"ended_at_utc":"2026-08-09T03:06:17.498097Z","identity":"P3-R01-4653223-20260809-I01-W10","inputs":[{"path":"artifacts/phase-3/P3-R01-4653223-20260809-I01/control/actor-assignments-formal.json","sha256":"a944b72283b5bd834c4d4e47ab7e68d1cb314714fc478e42d3383fbba0975dfb"},{"path":"artifacts/phase-3/P3-R01-4653223-20260809-I01/work-items/W09/receipt.json","sha256":"d886726eff569565e308e01ac04d05e207dfda44716691dcd85a5bc03fa41517"}],"outputs":[{"path":"artifacts/phase-3/P3-R01-4653223-20260809-I01/replay/observed-probability-replay.jsonl","sha256":"a240d903371745b0ec9d0c45a62332c7b466a567cac543b4112430a895a0df35"},{"path":"artifacts/phase-3/P3-R01-4653223-20260809-I01/replay/replay.json","sha256":"54562eaacc8accce3b9569f17acf71e5c5fc7c6326d315fdf0d0a7c47312b8aa"},{"path":"artifacts/phase-3/P3-R01-4653223-20260809-I01/review/independent-model-reconstruction.json","sha256":"1ba2a2dac9c7db579b41fc8052e7d0b2813a8f4691928f5abf5e0c5e796b245c"},{"path":"artifacts/phase-3/P3-R01-4653223-20260809-I01/review/review.json","sha256":"8d51565a5cf6b43a30efe2327261b8c4b14e2683ecdade71262cc564ccb65b02"}],"owner_id":"P3-W10-INDEPENDENT-REVIEWER-20260809-R01","owner_role":"independent_reviewer","owner_session_id":"P3-W10-INDEPENDENT-REVIEW-SESSION-20260809-R01-7C41E29B","owner_task_id":"/root/w10_independent_reviewer","process_exit_code":0,"schema_version":"3.0.0","started_at_utc":"2026-08-09T03:06:13.785004Z","status":"PASS","terminal":"PASS","work_item":"W10"}
